{
  "submissionId": "7e2f843e-d639-40b3-8611-8015f3a18959",
  "prosecutionCaseSubject": {
    "urn": "caseURN",
    "prosecutingAuthority": "The OU Code of the prosecuting authority"
  },
  "defendantSubject": [
    {
      "defendant": {
        "prosecutorDefendantId": "defendant Id"
      }
    }
  ],
  "trialDate": "1980-01-24",
  "lastRecordedTimeEstimate": 14,
  "hasAllEvidenceToBeReliedOnBeenServed": "Y",
  "hasAllEvidenceToBeReliedOnBeenServedDetails": "Details",
  "hasAllDisclosureBeenProvided": "Y",
  "hasAllDisclosureBeenProvidedDetails": "Details",
  "haveOtherDirectionsBeenCompliedWith": "Y",
  "haveOtherDirectionsBeenCompliedWithDetails": "Details",
  "haveTheProsecutionWitnessesRequiredToAttendAcknowledgedThatTheyWillAttend": "Y",
  "haveTheProsecutionWitnessesRequiredToAttendAcknowledgedThatTheyWillAttendDetails": "Details",
  "haveAnyWitnessSummonsesRequiredBeenReceivedAndServed": "Y",
  "haveAnyWitnessSummonsesRequiredBeenReceivedAndServedDetails": "Details",
  "haveSpecialMeasuresOrRemoteAttendanceIssuesForWitnessesBeenResolved": "Y",
  "haveSpecialMeasuresOrRemoteAttendanceIssuesForWitnessesBeenResolvedDetails": "Details",
  "haveInterpretersForWitnessesBeenArranged": "Y",
  "haveInterpretersForWitnessesBeenArrangedDetails": "Details",
  "haveEditedAbeInterviewsBeenPreparedAndAgreed": "Y",
  "haveEditedAbeInterviewsBeenPreparedAndAgreedDetails": "Details",
  "haveArrangementsBeenMadeForStatementOfPointsOfAgreementAndDisagreement": "Y",
  "haveArrangementsBeenMadeForStatementOfPointsOfAgreementAndDisagreementDetails": "Details",
  "isTheCaseReadyToProceedWithoutDelayBeforeTheJury": "Y",
  "isTheCaseReadyToProceedWithoutDelayBeforeTheJuryDetails": "Details",
  "isTheTimeEstimateCorrect": "Y",
  "isTheTimeEstimateCorrectDetails": "Details",
  "furtherInformationToAssistTheCourt": "FurtherInformation",
  "certifyThatTheProsecutionIsTrialReady": "Y",
  "certifyThatTheProsecutionIsTrialReadyDetails": "Details",
  "applyForThePtrToBeVacated": "Y",
  "applyForThePtrToBeVacatedDetails": "Details",
  "formCompletedOnBehalfOfTheProsecutionBy": "FormCompletedBySomeone",
  "certificationDate": "1980-01-24"
}